likes,caption
-16,"""Help us Bernie Sanders\n you're our only hope."""
-14,NOT BERNIE.\n REEK
-13,A FUTURE TO BELIEVE IN\n BERNIESANDERS.COM\n\n DEMOCRACY\n 2016\n SEN. BERNIE SANDERS IN FLINT FOR PANEL\n DISCUSSION ON WATER CRISIS\n\n ERTAREEI\n IETREEl\n\n A FUTURE T\n C\n BERNE ESA\n\n for us\n hillaryAnton Sm\n\n LIVE\n ABC News\n Jewish Federation\n OF GREATER DES MOINES\n abcNEWS\n .com
-12,"..ooo T-Mobile 3:34 PM\n Search\n Ethan Cac ftpl f\n Pretty sure that this is a post that could easily\n be misconstrued by people who aren't black\n The black panthers might not have had the\n correct mindsets or ideals for what they were\n fighting for but it ended up being one of the\n most empowering movements for black\n people to feel good about themselves and\n have the feeling of freedom in their daily lives\n However I don't think this post was meant for\n the eyes of diehard patriots because again,\n it's not true for everyone\n 1 hour ago Like 1 Reply\n Philip\n Eli LOC\n the This post is completely denying any\n credit to the men and women of the\n armed forces who kept this country\n safe, so these fucking terrorists could\n do whatever they felt like. Has nothing\n to do with patriotism, without the\n military the US wouldn't be a country\n Our origin is based around a militia who\n fought for what they believed in so\n people could have the freedom to do as\n they please. Burning cities and\n vandalizing makes you a terrorist\n 1 hour ago Edited Like\n 1 Reply\n Philip fomory oor\n I bet you're voting for Bernie too\n 1 hour ago Unlike 2 Reply\n Post\n CO Write a comment\n News Feed\n Notifications\n Requests\n Messenger\n More\n\n OV\n aby\n O Emmaon\n OW\n ok baby\n Ethan Sahar\n epiv\n Glad to have a guy like you fighting for\n my country!\n 44 minutes ago Like Reply\n Philip ilinmemenu\n Omg that's the best comeback ever bro\n What have you done for your country?\n Absolutely fucking nothing. I've been in\n the army for less than 2 years, helped\n keep South Koreans trained and ready\n for a fight against the north and\n deployed too Afghanistan. Oh and by\n the way, just because I used facts you\n get all butt hurt and make it personal\n Fuck you, America owes you nothing\n Don't ever fucking talk to me ever again,\n and if you want to say it too my face\n Then please attempt to hurt me with\n your mean words and\n I'll make your\n darkest of nightmares come true. Don't\n fuck with someone who indefinitely will\n beat your ass. Probably not your best\n move there pal. And trust me, I don't\n believe in safe spaces\n 2 Reply\n 40 minutes ago Like\n e Ethan\n ere\n th...\n Why do you think I'd ever want to talk to\n someone who threatens people over\n Facebook and gets defensive over\n America? Keep on keeping on buddy\n Post\n O Write a comment\n News Feed\n Notifications\n Requests\n Messenger\n More\n\n 3:34 PM\n Ooo T-Mobile\n Search\n America? Keep on keeping on buddy\n 33 minutes ago Like Reply\n 33 m\n dehilireet\n Philip Pk Hant\n Want too know why I get defensive over\n the greatest country in the world?\n Because I swore a fucking oath multiple\n times to protect her from enemy's\n foreign and domestic. Yeah I get\n defensive and when you talk blasphemy\n against the country l love, yeah l will\n stand behind facts and use them against\n you, when you're an ignorant simpleton\n who feels the world owes you free\n College, 15/hour wages. Guess what\n motherfucker, when you narrow it down l\n make 8.25 an hour, and have worked\n harder, and done more for my country in\n 2 years than you could possibly dream\n of. I hope life treats you well, and maybe\n one day you'll wake up and realize that\n you're an ignorant buffoon. Take you,\n and your weak ass comments\n somewhere else. At least have a good\n comeback... Shits just weak man\n 29 minutes ago Like\n 1 Reply\n Ethan thntsthr\n of. Yeah, you're right, my comebacks suck\n and that's what matters\n 26 minutes ago Like Reply\n m. Philip Pmre\n ers\n Post\n O Write a comment\n News Feed\n Notifications\n Requests\n Messenger\n More\n\n 3:35 PM\n Ooo T-Mobile\n Search\n Philip Gacmanme\n ns, au You've made absurd claims, and have no\n facts to stand behind what you're\n attempting to debate. You have been\n awarded 0 points and may God have\n mercy on your soul\n 25 minutes ago Like\n 2 Reply\n Ethan 3nrwhwne\n ta Why do you feel like you have something\n to prove?\n 24 minutes ago Like Reply\n Philip klornan\n I don't, just standing up for what\n believe in, and you're getting in your\n feelings about it. Typical Bernie\n supporter\n 23 minutes ago Like Reply\n Destiny t Sara\n Ethan, I don't agree with everything\n Philip is saying. But it's best to just leave\n it alone. He has a lot to prove. He's\n braved a lot of things most of us will\n never have to face. And that's because\n of him. He makes it so we don't have to\n Regardless of nationality. If you live in\n America,\n You don't have to see Any of that\n because of people like him. Literally just\n show some respect and move on\n 22 minutes ago Unlike\n r 1 Reply\n Post\n O Write a comment\n News Feed\n Messenger\n Notifications\n Requests\n More\n\n 3:35 PM\n Ooo T-Mobile\n Search\n enen\n Ethan see, she's a liberal who shares\n some of your beliefs, and isn't in her\n feelings, and has never and will never\n question my patriotism, love for my\n country and duty and my undying love\n for this country. Don't comment on a\n post unless you want rebuttal. Because\n just as you have the first amendment\n right to speak up and speak your mind. I\n exercise the same right in responding\n too you. And based off of your post, you\n didn't seem very educated on the topic\n so I dropped a knowledge bomb on you\n Get butt hurt I couldn't care less. Like I\n said, I don't respect your safe space\n from my words. And if you don't like it.\n Block me. It's just too simple\n 18 minutes ago Like\n r 2 Reply\n Destiny iwav\n will always have your back Philip\n know how hard you've fought and it\n doesn't go unnoticed.\n 17 minutes ago Like 1 Reply\n Philip Stmcsmcste\n Destiny thank ya very much.\n appreciate it.\n 17 minutes ago Like 1 Reply\n D Destiny nnte\n no Write a comment\n Post\n News Feed\n Messenger\n Notifications\n Requests\n More\n\n 3:35 PM\n ooooo T-Mobile\n Search\n I will always have your back Philip.\n know how hard you've fought and it\n doesn't go unnoticed\n 17 minutes ago Like\n 1 Reply\n Philip tmomoa\n Destiny thank ya very much.\n appreciate it.\n 17 minutes ago Like\n 1 Reply\n Destiny eain\n Just keep using facts and they will\n slowly weed themselves out. It's the\n easiest tactic\n 16 minutes ago Like\n 1 Reply\n Philip menGmett\n #killemwithknowledge\n 15 minutes ago Like\n 2 Reply\n Destiny tip\n Pretty much\n 15 minutes ago Like 1 Reply\n Ethanm ith itt itt\n I think I'll just move on.\n 12 minutes ago Like\n 1 Reply\n tr Philip GmesreORA\n That's fine, I'll keep working to maintain\n your rights, and you can show no\n respect and just go ahead and fuck\n vourself\n Post\n Oa Write a comment\n News Feed\n Messenger\n Notifications\n Requests\n More\n\n 3:35 PM\n ooooo T-Mobile\n a Search\n 15 minutes ago Like\n 2 Reply\n Destiny Muste\n Pretty much\n 15 minutes ago Like\n 1 Reply\n Ethan JemuctHnd\n I think I'll just move on.\n 12 minutes ago Like\n 1 Reply\n Philip non macn.\n That's fine\n I'll keep working to maintain\n your rights, and you can show no\n respect and just go ahead and fuck\n yourself\n 12 minutes ago Like\n 2 Reply\n I tr Ethan\n Jlinno in\n Thanks dude!\n 9 minutes ago Like Reply\n Philip\n posde\n 9 minutes ago Unlike 3 Reply\n Philip nornano p\n This roast brought to you by: Every\n history book ever and Merica #fuckyeah\n Just now. Like Reply\n O Write a reply\n Post\n Write a comment\n Post\n More\n News Feed\n Requests\n Messenger\n Notifications"
-10,"..ooo T-Mobile 3:34 PM\n Search\n Ethan Cac ftpl f\n Pretty sure that this is a post that could easily\n be misconstrued by people who aren't black\n The black panthers might not have had the\n correct mindsets or ideals for what they were\n fighting for but it ended up being one of the\n most empowering movements for black\n people to feel good about themselves and\n have the feeling of freedom in their daily lives\n However I don't think this post was meant for\n the eyes of diehard patriots because again,\n it's not true for everyone\n 1 hour ago Like 1 Reply\n Philip\n Eli LOC\n the This post is completely denying any\n credit to the men and women of the\n armed forces who kept this country\n safe, so these fucking terrorists could\n do whatever they felt like. Has nothing\n to do with patriotism, without the\n military the US wouldn't be a country\n Our origin is based around a militia who\n fought for what they believed in so\n people could have the freedom to do as\n they please. Burning cities and\n vandalizing makes you a terrorist\n 1 hour ago Edited Like\n 1 Reply\n Philip fomory oor\n I bet you're voting for Bernie too\n 1 hour ago Unlike 2 Reply\n Post\n CO Write a comment\n News Feed\n Notifications\n Requests\n Messenger\n More\n\n OV\n aby\n O Emmaon\n OW\n ok baby\n Ethan Sahar\n epiv\n Glad to have a guy like you fighting for\n my country!\n 44 minutes ago Like Reply\n Philip ilinmemenu\n Omg that's the best comeback ever bro\n What have you done for your country?\n Absolutely fucking nothing. I've been in\n the army for less than 2 years, helped\n keep South Koreans trained and ready\n for a fight against the north and\n deployed too Afghanistan. Oh and by\n the way, just because I used facts you\n get all butt hurt and make it personal\n Fuck you, America owes you nothing\n Don't ever fucking talk to me ever again,\n and if you want to say it too my face\n Then please attempt to hurt me with\n your mean words and\n I'll make your\n darkest of nightmares come true. Don't\n fuck with someone who indefinitely will\n beat your ass. Probably not your best\n move there pal. And trust me, I don't\n believe in safe spaces\n 2 Reply\n 40 minutes ago Like\n e Ethan\n ere\n th...\n Why do you think I'd ever want to talk to\n someone who threatens people over\n Facebook and gets defensive over\n America? Keep on keeping on buddy\n Post\n O Write a comment\n News Feed\n Notifications\n Requests\n Messenger\n More\n\n 3:34 PM\n Ooo T-Mobile\n Search\n America? Keep on keeping on buddy\n 33 minutes ago Like Reply\n 33 m\n dehilireet\n Philip Pk Hant\n Want too know why I get defensive over\n the greatest country in the world?\n Because I swore a fucking oath multiple\n times to protect her from enemy's\n foreign and domestic. Yeah I get\n defensive and when you talk blasphemy\n against the country l love, yeah l will\n stand behind facts and use them against\n you, when you're an ignorant simpleton\n who feels the world owes you free\n College, 15/hour wages. Guess what\n motherfucker, when you narrow it down l\n make 8.25 an hour, and have worked\n harder, and done more for my country in\n 2 years than you could possibly dream\n of. I hope life treats you well, and maybe\n one day you'll wake up and realize that\n you're an ignorant buffoon. Take you,\n and your weak ass comments\n somewhere else. At least have a good\n comeback... Shits just weak man\n 29 minutes ago Like\n 1 Reply\n Ethan thntsthr\n of. Yeah, you're right, my comebacks suck\n and that's what matters\n 26 minutes ago Like Reply\n m. Philip Pmre\n ers\n Post\n O Write a comment\n News Feed\n Notifications\n Requests\n Messenger\n More\n\n 3:35 PM\n Ooo T-Mobile\n Search\n Philip Gacmanme\n ns, au You've made absurd claims, and have no\n facts to stand behind what you're\n attempting to debate. You have been\n awarded 0 points and may God have\n mercy on your soul\n 25 minutes ago Like\n 2 Reply\n Ethan 3nrwhwne\n ta Why do you feel like you have something\n to prove?\n 24 minutes ago Like Reply\n Philip klornan\n I don't, just standing up for what\n believe in, and you're getting in your\n feelings about it. Typical Bernie\n supporter\n 23 minutes ago Like Reply\n Destiny t Sara\n Ethan, I don't agree with everything\n Philip is saying. But it's best to just leave\n it alone. He has a lot to prove. He's\n braved a lot of things most of us will\n never have to face. And that's because\n of him. He makes it so we don't have to\n Regardless of nationality. If you live in\n America,\n You don't have to see Any of that\n because of people like him. Literally just\n show some respect and move on\n 22 minutes ago Unlike\n r 1 Reply\n Post\n O Write a comment\n News Feed\n Messenger\n Notifications\n Requests\n More\n\n 3:35 PM\n Ooo T-Mobile\n Search\n en en\n Ethan see, she's a liberal who shares\n some of your beliefs, and isn't in her\n feelings, and has never and will never\n question my patriotism, love for my\n country and duty and my undying love\n for this country. Don't comment on a\n post unless you want rebuttal. Because\n just as you have the first amendment\n right to speak up and speak your mind. I\n exercise the same right in responding\n too you. And based off of your post, you\n didn't seem very educated on the topic\n so I dropped a knowledge bomb on you\n Get butt hurt I couldn't care less. Like I\n said, don't respect your safe space\n from my words. And if you don't like it\n Block me. It's just too simple\n 18 minutes ago Like\n 2 Reply\n Destiny iwav\n will always have your back Philip. l\n know how hard you've fought and it\n doesn't go unnoticed.\n 17 minutes ago Like r 1 Reply\n Philip Densmore\n Destiny thank ya very much.\n appreciate it\n 17 minutes ago Like\n 1 Reply\n Destiny Nye\n Post\n O Write a comment\n News Feed\n Messenger\n Notifications\n Requests\n More\n\n 3:35 PM\n ooooo T-Mobile\n Search\n I will always have your back Philip.\n know how hard you've fought and it\n doesn't go unnoticed\n 17 minutes ago Like\n 1 Reply\n Philip tmomoa\n Destiny thank ya very much.\n appreciate it.\n 17 minutes ago Like\n 1 Reply\n Destiny eain\n Just keep using facts and they will\n slowly weed themselves out. It's the\n easiest tactic\n 16 minutes ago Like\n 1 Reply\n Philip menGmett\n #killemwithknowledge\n 15 minutes ago Like\n 2 Reply\n Destiny tip\n Pretty much\n 15 minutes ago Like 1 Reply\n Ethanm ith itt itt\n I think I'll just move on.\n 12 minutes ago Like\n 1 Reply\n tr Philip GmesreORA\n That's fine, I'll keep working to maintain\n your rights, and you can show no\n respect and just go ahead and fuck\n vourself\n Post\n Oa Write a comment\n News Feed\n Messenger\n Notifications\n Requests\n More\n\n 3:35 PM\n ooooo T-Mobile\n a Search\n 15 minutes ago Like\n 2 Reply\n Destiny Muste\n Pretty much\n 15 minutes ago Like\n 1 Reply\n Ethan JemuctHnd\n I think I'll just move on.\n 12 minutes ago Like\n 1 Reply\n Philip non macn.\n That's fine\n I'll keep working to maintain\n your rights, and you can show no\n respect and just go ahead and fuck\n yourself\n 12 minutes ago Like\n 2 Reply\n I tr Ethan\n Jlinno in\n Thanks dude!\n 9 minutes ago Like Reply\n Philip\n posde\n 9 minutes ago Unlike 3 Reply\n Philip nornano p\n This roast brought to you by: Every\n history book ever and Merica #fuckyeah\n Just now. Like Reply\n O Write a reply\n Post\n Write a comment\n Post\n More\n News Feed\n Requests\n Messenger\n Notifications"
-9,"Bernie or Hillary?\n Be informed. Compare them on the issues that matter.\n MEMES\n Issue:\n ""I enjoy watching\n those Montage Paro-\n ""Damn Daniel""\n dies on YouTube""\n obvious plant"
-9,"(C) 1991 AdM Records Temple of the Dog ""Hunger Strike""\n I don't mind stealing bread from the mouths of decadence,\n but I can't feed on the powerless when my cup's already overfilled.\n But it's on the table, the fire's cooking and they're farming babies\n while slaves are all working.\n And it's on the table, the mouths are\n ing, but I'm going hungry\n Bernie Sanders 2016"
-9,GUESS WHO JUST CAME\n FROM\n A BERNIE SANDERS RALY p
-7,"what if h3h3 was black?\n #Project Murphy\n\n project Mu phy net\n what if Steve buchemi was\n black?\n #Project Murphy\n\n what if vault boy was a marshamallow?\n Proiect Murphy\n\n NACo\n TOUGH\n pro Murphy net\n what if the shaq was a\n midget? Proiect Murphy\n\n www.cgstock com\n Chris Gregerson, 20\n Murphy net\n what if jinx was white?\n #Project Murph\n\n www.cgstock com\n Chris Gregerson, 20\n Murphy net\n what if ksi was white?\n #Project Murph\n\n what if energizer bunny was black?\n #ProjectMurphy\n\n Ct Murphy net\n what if buzz aldrin was john kasich?\n Project Murphy\n\n what if anonymous did\n 9/11? Proiect Murphy\n\n what if papa john looked like luke skywalker?\n #Project Mur\n hy ne\n\n project Murphy net\n what if bernie sanders was ted cruz?\n #Project Murphy\n\n project Murphy ne\n what if carl grimes was an alien?\n #ProjectMurphy\n\n project Murphy\n what if michael jordan was asian?\n #ProiectMurphy\n\n Dreject Murphy net\n what if nicholas cage was a\n banana?\n #Proiect Murphy\n\n project Murp\n what if captain price was the flash?\n #ProiectMurphy\n\n Murphy net\n what if rick grimes was a cookie?\n #Project Murphy\n\n what if hillary clinton was donald trump?\n #ProjectMurphy\n\n Murphy net\n what if will smith\n was a cookie?\n #Project Murphy\n\n project Murphy ne\n what if buzz aldrin was martin\n o'malley?\n #Project Murphy"
-5,"kstory This is Khaled Assad. ISIS militants beheaded him 1-year ago and hung his body in the square because he refused to\n 5981\n reveal where they had hidden Palmyra Antiques\n (i.imgur.com)\n 17 h\n kd hid\n 416\n sorted by: top\n navigate by submitter\n moderator friend me\n admin highlighted tagged gilded IAmA images videos popular\n new\n you are viewing a single comment's thread\n view the rest of the comments\n view the full context\n hidden] 35\n I totally understand, as Reddit bots and karma whores a\n a real thing. Apology accepted, and let us both remember\n this man for what he did.\n I apologize too for not altering the original title enough\n ply hid\n RES pa\n port gi\n 0 points\n 30\n Yeah but you really really love to repost shit and then delete it and then repost it again, don't you? You're not a bot,\n you're just not witty enough to come up with your own content, let alone and original title. It's kinda sad\n t edit d\n ble\n delet\n RES pa\n hidden) 12.\n t edited 6\n Look at my submitted posts?! Those are all original, bud\n I'm sorry but I'm just not the monster you guys want me to be. I'm just an average redditor.\n Divide my total karma score by the number of days my account has been active. It's like 30 karma/day\n reposting super user""\n I'm not even close to a\n Edit: even funnier, since some of my more recent successful posts in /r/nostalgia\n I've noticed a lot of people\n actually are using my original title to format their own posts\n RES pa\n port g\n 1 point\n http://karmadecay.com/user/BoomShakaLakka\n Just because you delete them doesn't mean it doesn't still exist somewhere.\n t edit d\n ble\n RES pa\n search\n this post\n 5,981\n 7.869 votes\n hort\n h\n pics\n 12,951,45\n O 13,744\n A place to\n Feel free t\n the rules\n are not a\n screen sho\n Spoiler\n Please ma\n text he\n Hover ove\n Check out\n Posting\n I. No\n add\n Incl\n map\n\n found 4 similar images\n 17 hours ago\n This is Khaled Assad. ISIS militants beheaded\n him 1-year ago and hung his body in the square\n because he refused to reveal where they had\n hidden Palmyra Antiques.\n most recent duplicate shared 25 days ago\n found 5 similar images\n 17 hours ago\n New Baby Hippo at the San Diego Zoo.\n most recent duplicate shared 1 month ago\n found 3 similar images\n 3 days ago\n Gargoyles TV show! Great cartoon from the\n early 90s\n most recent duplicate shared months ago\n found 10 similar images\n 2 months ago\n MRW wyl\n I hear the radio station say the\n hen have two free tickets to the midnight premiere of\n Gone With The Wind for whoever gets there\n first.\n most recent duplicate shared 3 months ago\n found 5 similar images\n 3 months ago\n How fee\n when European Bernie cucks\n complain about Americans...\n most recent duplicate shared 1 year ago\n found 3 similar images\n 3 months ago\n Thought you guys might be interested to see\n exactly how much it costs to make your food at\n McDonalds\n most recent duplicate shared 2 years ago\n\n New Baby Hippo at the San Diego Zoo\n li.imgur.com)\n 4834\n Doe submitted 18 hours ago by ld\n 165 nts (3 new) kd hide all child comments\n all 165 comments\n subscribe\n sorted by: top v\n navigate by v\n Speaking as: strallweat\n 0/10000\n REMEMBER\n Be nice\n No bots\n No slurs or harassing comments\n No linking to personal social media pages\n No asking for donations (Try /r/Assistance)\n content policy formatting help\n big editor\n Save\n 554 points\n 16 hours a\n New\n permalink source embed save save-RES report give gold reply hide child comments\n This is an archived post. You won't be able to vote or comment.\n San Diego Zoo's baby hippo\n 7823\n ode submitted 1 year ago by\n 211 comments share save hide\n give gold report kd hide all child comments\n top 200 comments how all 211 4 subscribe\n sorted by: top v\n navigate by v"
-4,"What 2016 would look like if just\n communists voted\n hat Lenin's body\n from the\n MOSCOW\n mausoleum\n Gulag sentence\n Trump\n 350\n 188 clinton\n (number of centuries)\n The ghost of\n Joseph Stalin\n Castro the\n Undying\n An ear of corn\n grown in the\n Siberian wastes\n The People's\n Front of Judea\n The Judean\n People's Front\n There are actual\n communists\n living here...?\n J. Posadas\n (ayy mao\n CP Were not\n working for the\n FBI, we swear\n USA\n Leon ""Probably\n would've been\n better than\n Nebraska's 5 electoral votes\n Maine's 4 electoral votes\n Stalin"" Trotsky\n STATEWIDE:\n STATEWIDE\n DISTRICTS\n DISTRICTS\n Bernie's a\n socialist, right?"""
-4,ooooo ROGERS 11:47 PM\n T 25%\n upandoutcomic\n Bernie feel the bern.usa\n Our strategy to win\n is quite simple.\n SUPERCALIFORNLOGISTICS\n EXPIALIDELEGATESTI\n 68 likes\n COO
-4,SO HILLARY AND BERNIE ARE\n DEBATING SOCIALISM\n AND CRUZ IS BUSY WITH CAITLYN\n JENNER'S FACEBOOK VIDEO\n on Ingur
-4,"Bernie or Hillan\n Be informed. Compare them on the issues that matter.\n Issue:\n WHAT IS LOVE?\n Don't Hurt Me,\n Got to do\n Don't Hurt Me,\n it?\n No More\n with"
-3,New Clinton campaign\n merchandise Welcomes\n Bernie supporters.\n I'M WITH HER
-2,"Williamsburg, Brooklyn Half-Man Starter Pack\n FEEL\n MEAT\n BERN\n FREE\n ZONE\n BERNIE SANDERS.COM\n VEGAN"
-2,Do you really want to live\n in a country where Purell\n spares the top 0.01% of\n germs while the bottom\n 99.9% suffer?\n & WORLD REPORT\n Win McNamee/Getty Images\n Thomas Casey\n Bernie Sanders
