likes,caption
0,or VERMI\n Be informed. Compare them on the issues that matter.\n Issue: Hygiene\n nstitute of\n MINT\n COLL\n Strong teeth for a\n I cannot control my\n strong America\n own hair. How am\n I\n supposed to control a\n Country?\n\n Bernie or VERMI\n Be informed. Compare them on the issues that matter\n Issue: Zombie Preparedness\n nstitute of\n COLL\n We will trap zombies\n Is this a real issue?\n in giant hampster\n wheel turbines and get\n free energy\n\n Bernie or VERMI\n Be informed. Compare them on the issues that matter.\n Issue: Economics\n nstitute of\n COLL\n Ponynomics 101: Free\n All my plans are\n ponies are free. They do\n extremely expensive\n not cost tax payer money.\n They do create jobs.\n\n Bernie or VERMIN\n Be informed. Compare them on the issues that matter.\n Issue:\n Free Ponies\n nstitute of\n COLL\n\n Bernie or VERMIN\n Be informed. Compare them on the issues that matter.\n Issue: Guns\n nstitute of\n MINT\n COLL\n People don't kill\n people. Guns kill\n people
0,"2016 US Presidential Candidates\n & WESTERDS COUNTERPARTS\n MARCO RUBIO RENLEY BARATHEDN\n JEB! BUSH STANNIS BARATHEDN\n tylish\n groomed men both\n f\n Both\n ke b\n g the\n by\n ghtful\n ght. They\n both lack the thing they\n pfrog th\n tag\n ppeal/pop\n they p\n y. B\n thing th\n bling\n they're hoping that h\n g the backing\n bigg\n bank\n the land (Th\n pport\n Bank/Koch Broth\n d help\n RICK SANTORUM MATHDSSEAWORTH CTV)\n MIKE HUCKABEE BAELDN GREY JOY\n Both are stubbornly stuck\n ys and\n Both\n that d\n dated\n fusing\n ty wh\n anyone but themselves and their religio\n dge th\n de has changed\n dogm\n d ultim\n y d\n good at th\n LINDSEY GRAHAM SER MERAN TRANT JOHN KASICH SER KEVAN LANNISTER\n Both\n dered\n be d\n Both\n d guard th\n headed\n ho h\n d id\n by\n desperately trying\n k and d\n d th\n he b\n about how things should\n ying\n ding up\n em. And whil\n rt/congress\n hey d\n he day they both\n BEN CARSON SALLADHDR SAAN\n CARLY FIORINA SHAE (Book)\n Both\n that ha\n Both\n d the p\n y attra\n the politi\n find them as\n gg\n ge yi\n oriety and the monetary gain t\n king in,\n hat they try\n th it.\n nd half truths\n hey\n TED CRUZ RAMSAY BOLTDN\n CHRIS CHRISTIE CRASTER\n Both\n h tha\n rld burn.\n rth\n both d\n d tha\n hing\n d like\n travel through (or inside) as\n peop\n demand pect fr\n They\n g th\n hild\n the d\n hady big b\n walk\n ght p\n JIM WEBB RANDAL TARLY\n MARTIN O'MALLEY PETYR BAELISH\n Both men are masterfully mil\n ded b\n The bigg\n similarity is th\n the backgr\n playing Petyr B\n gely got his part\n GOT\n rgely\n ght.\n he character he played.\n The W\n OM\n ey. Aside fr\n both men don't\n he pedigr\n play\n s/ob\n d h\n hat ha\n en much better da\n RAND PAUL SER LORASTYRELL\n hey d\n lot of the same\n proclivities, they do\n sh\n rly\n rywhe\n hey\n tantly\n ks. They also benefit from name\n emarry increasingly younger women, and both\n figh\n hey b\n ke brag about h\n bangab\n daught\n n, b\n y they\n Neith\n y by any\n quite g\n hearts d\n he equally he\n fic traged\n dding & Super T\n day\n BERNIE SANDERS HIGH SPARROW\n HILLARY\n LADY DLENNA/MARGAERY TYRELL\n Th\n The thing\n the COmrmon.\n hold the\n man and Sha\n their crimes and\n hey\n pti\n ELIZABETH WARREN DAENERYSTARGARYEN (KHALEESI, MOTHEROF DRAGONS, BREAKER OF CHAINS)\n he p\n biding the\n ike. Whi\n hey\n truggl\n g he\n d, they\n dy\n rted changing th\n d began the p\n g th\n debted\n k th\n poke\n blish\n d be th\n s the lands the\n ptul\n desp\n d. Fort\n y, the\n d support\n tinue to rise and grow as the\n prep\n ge th\n futu\n paigns"
0,"Democratic\n Socialism\n Socialism\n Like Reply 40 mins\n Not really, nope. Bernie isn't even a Democratic Socialist\n he's a Social Democrat. He doesn't think the government should own\n the means of production or that private property should be eliminated.\n He's really less of a ""Socialist"" than FDR, maybe even Eisenhower\n But, if all Socialism truly is bad, then l guess we should start by getting\n rid of public education, roads, infrastructure, and libraries.\n Bernie\n WHAT ISSOCIALDEMOCRACY?\n Like Reply 31 mins\n Go to Google\n Type in ""the problems with bernie sanders socialism""\n Start educating yourself\n Like Reply\n 13 mins\n El must go to bed now. Some of us have to get up and\n go to work in the morning. After all someone has to pay for all the\n ""free' stuff the last guy is giving away.\n Like Reply 9 mins\n m almost done writing my senior thesis paper on Bernie\n style social democracy. I'd love to hear directly from you which\n specific problems you have.\n But, okay. Goodnight. have to stay up to keep taking an online class\n on an outdated coding language just to be able to get a few extra\n thousand dollars towards college that l cant afford without going about\n $25K into student debt despite working hard to get my 31 on the ACT.\n After a\n some of us have to grow up in this economy we didn't create\n Like Reply 4 mins\n Write a reply"
0,"""When you're white you\n don't know what it's like to\n be living in a ghetto, you\n don't know what it's like to\n be poor, you don't know\n what it's like to be hassled\n when you walk down the\n street, or dragged out of a\n Car.""\n Sen. Bernie Sanders\n March 6th 2016 Democratic Debate"
0,"shared HuffPost Politics\n s video\n 1 hr\n If you plan on voting for trump, you're probably just as arrogant and\n disgusting as he is. If that pathetic excuse of a man is put into office, l\n genuinely hope he's JFKed. (assassinated. just in case you're stupid)\n Feel the burn\n The remarkable ascent of Bernie Sanders\n portends far more than an unexpectedly\n 1,481,265 Views\n HuffPost Politics\n Like Page\n March 4 at 6:16pm\n Bernie Sanders has already changed America, even if he loses the nomination to\n Hillary Clinton. Oscar-winner Charles Ferguson explains why\n Like Comment\n a Share"
0,Bernie Bernie Sanders\n a Bernie Sanders\n North Korea is one of the biggest threats we face.\n Their economic and social policies have created a\n monstrous dictator we have to stop.\n 599\n 705\n NORTH KOREA IS EVIL!\n SOCIALISM IS THE\n WORST! THOSE EVIL\n ECONOMIC POLICIES\n CREATED DICTATORS\n THERE AND IN MANY\n OTHER COUNTRIES!\n DON'T FORGET TO VOTE\n FOR SOCIALIST\n SANDERS IN 2016!\n #FEELTHEBERN BABY!
0,"2 hrs\n l was going to vote for Bernie but l couldn't find him on the ballot. All I saw\n was Donald trump, Marco Rubio, Ted Cruz, and a few others. Is anyone\n else having the same problem?\n You were given a Republican Primary ballot you should have\n asked for a Democratic Primary ballot.\n Like Reply 12-2 hrs\n I just wrote in Bernie. Can Igo back and ask for a democratic\n one?\n Like Reply 7-2 hrs\n And were you registered as a Republican or a Democrat?\n Like Reply 1-2 hrs\n I don't know. I've never done this before\n Like Reply 7-2 hrs Edited\n I used to work elections in both Alaska and here in California\n and I can tell you, that you're given the primary ballot for the Political Party\n that you are registered in. If you're an Independent or Non-affiliated then they\n will ask you which ballot you want.\n Like Reply 1-2 hrs Edited\n Damn, so can I go back?\n Like Reply 3-2 hrs\n If you haven't yet voted go back and ask for a Democratic Ballot.\n Like Reply 2-2 hrs\n Ill just go back and explain what happened to them.\n Like Reply 12-2 hrs\n omg this scares the shit out of me. how many people could\n his possibly be happening to outthere that are new to voting? my stomach is\n in knots\n Like Reply 9 1 hr\n Sorry for the delay. ent back and they said l wasn't allowed to\n vote again. asked if it Would still count as a vote for Bernie and they said no\n which makes literally no sense to me. Iflput his name down why would it not\n count as a vote for him?\n Like Reply 1 1 hr Edited\n Because Bernie was not a valid write-in candidate on\n the Republican Ticket.\n Like Reply 27 mins\n Ugh, I'm so confused. I give up\n Like Reply 26 mins"
0,"10:23 AM\n 88%\n ooo Sprint LTE\n Search\n raise the cost of goods. Idea #2: Stop allowing\n corporations (which are legal entities, NOT\n people) to exist without impunity\n 5 minutes ago Edited Like Reply\n ol point blank- Hillary has lied and had OUR\n ppl killed and she covered it. Not what we\n need. And on a lighter note\n any woman\n who can't keep her own man happy\n especially when he is running the top office)\n i know cant help our country if she is in\n charge\n As far as Bernie l refuse to even take time to\n look into his side of things. He is too damn\n Trump I like his ""make America great again'\n speech but his mouth over rides his ass\n While he has no remorse for his thoughts and\n words said, he has to know when to shut his\n mouth so we don't end up in a ww3\n Love he had balls, hate he doesn't know when\n to shut up\n I just stick to Jesus! And know that in the end\n these political mess really effects us but we\n have no control over the bs. l hate what Hilary\n and Obama has done and allowing as of\n today but again l'm just a white girl in the\n south.. just load my guns, mind my business,\n protect my family, and worship the man\n upstairs\n O Write a comment\n Post\n News Feed\n Messenger\n Notifications\n Requests\n More"
0,2 hrs\n THAT AwKWARD MoMENT wHEN...\n I. BERNIE SANDERS ADMITs HE IS A\n DEMocRATIC SoCIALIST.\n 2. NAZIS wERE DEMocRATIC\n SoCIALISTs\n 3. AMERICA\n FOUGHT AN ENTIRE\n WORLD WAR To STOP THE ADvANCE oF\n DEMocRATIC SoCIALISTS.\n SINCERELY SANE AMERICANS\n Like Comment\n a Share\n and 9 others\n A Nazi is a member of the National Socialist German Workers'\n Party. They are not Democratic Socialists.\n Like Reply 12 mins\n Write a comment...
0,"Native American\n Bernie Sanders\n Supporters aren't\n calling themselves\n ""Indian Berns,""\n they re doing It\n wrong.\n TJ Wharry\n @twharry"
0,"As a Virginia\n m embarrassed that Trump won my state, even if it's just\n the Republican Primary. We have the fourth best public school system in\n the country and we're blowing it.\n Like Comment\n Share\n and 5 others\n Theres a fairly good chance some bernie supporter will shoot\n him if he gets elected. The secret service doesn't exactly have the greatest\n track record\n Like Reply 30 mins Edited\n Write a comment..."
0,"COMMONWEEALTH OF VIRGINIA\n OFFICIAL BALLOT\n County of Fairfax\n MOCRATIC PARTY PRESIDENTIAL PRIMARY\n Tuesday, March 1, 2016\n ESTADO DE VIRGINIA\n PAPELETA OFICIAL\n Condado de Fairfax\n A PRESIDENCIAL DEL PARTIDO DEMOCRAT A\n Martes, 1 de marzo 2016\n President\n (Vote for only one)\n Presidente\n (Votar por solamente uno)\n Hillary Clinton\n Martin J. O'Malley\n Bernie Sanders"
0,BRACE YOURSELF\n DISAPPOINTED BERNIE SANDERS\n SUPPORTERS ARE COMING\n made on inngur
0,"You have two cows...\n Hillary Clinton\n The government takes one cow\n and gives it to your neighbor.\n Bernie Sanders\n You give both to the government, and the\n government then gives you some milk.\n Donald Trump\n Some rich ass\n takes both through\n eminent domain, hires you to take care\n of them, and sells you a small percent\n of the milk for an exorbitant price.\n Libertarian\n You have two cows. You sell one and\n buy a bull to breed a herd of cattle.\n OCCUPY DUMBocRATS http://blamethelst.blogspot.com/"
0,me. bored. tryna get my\n my cats\n in heat\n just\n MEAT SLOPPED\n begging to be\n fucced.\n lmao yea\n finna\n fucc this\n pussy pussy?\n cat\n FUCK YEAH DADDY\n DADDY DRINK YOUR\n NUT\n ATERS GONNA HATE\n this nigga want.\n me to drink my\n nutt? fucc yea\n ima drink my\n nutt\n BERNIE SANDERS WOULD BE\n A BAD PRESIDENT
0,"BERNIE\n Bernie Bemie Bernie Bernie\n FB.com/Capitalists\n When plunder becomes a way of\n lite for a group menina Society,\n Over the Course of time they Create for\n themselvesa legal system that authorizes\n it and a moral code that glorifies it.\n Frederic Bastiat"
0,"m suicidal. I dont want to live in a world without bernie as president\n self politics\n submitted 2 minutes ago b\n just\n dont know whats going on. My life has fallen apart\n My new years resolution was to work my ass off (i live in nevada) to get bernie to win here.\n And he just got destroyed. dont understand. Why dont blacks and latinos like bernie? I mean the man was actually\n part of civil rights yet all of these minorities turn out to vote for a woman who is bought out by the same corporations\n that hate them.\n have been working so hard that its put a strain on my relationships. Its gotten so bad that my girlfriend asked ""to see\n other people""\n know what you are saying ""dude are you serious what a bitch!"" its okay though we are still together she just when\n she has urges she has a friend she goes too and you know whatever\n Buts thats not the fucking problem\n met the guy today and not only is he a BLACK guy. But he apparently just got back\n for caucusing for clinton.\n Every layer of my life is being taken away My existence for the past week has been of humiliation.\n The woman l wanted to marry is having sex with a black dude who doesnt even know bernie sanders civil rights record.\n I just cant do this shit anymore. At least If bernie was president i could build a new life. But at this point im going to lose\n the woman\n l love to a fucking Clinton supporter and one that helped get that vile whore elected while probly spewing\n some stupid fucking black lives matter shit."
0,"IF BERNIE GOES TO WASHINGTON\n ...And Bernie entered\n Washington and drove out\n all who sold and bought\n their politics, and he\n overturned the tables of the\n shadow bankerS and the\n Seats of those bankers too\n big to fail. He said tothem,\n ""It is written, My Country\n shall be called a country of\n democracy, Dutyou make it\n a den of robbers."
0,Middle-aged Tucson Woman Starter Pack\n CAMEE!\n be\n kind\n CAMELEA\n ben's bells project\n Bernie Coeoist\n Hand in Hand\n ENDLESS\n Tucson Peace Center\n WAKEUP\n FREE PALESTINE\n HEALTHCARE\n NOT ARE\n ESS THE OCCUPATION\n Oldsmobile\n WE\n SILHOUETTE\n EDUCACION SI\n STAND\n WITH\n Think Globally\n ROSA\n occupy Locally\n BANVotingMachines.org\n Keep Tucson Together
0,"98% 12:55 PM\n LTE\n K Daddy\n 02/26/2016 Fri\n FYI, I just caught a Car full of boys\n stealing the Bernie sign from our\n yard. chased them down, fussed at\n them and made them give me the\n sign back!\n I respect your right to endorse your\n candidate!\n 12:49 PM\n Holy crap! Thank you! Is it back in\n the ground?\n Did you ask them what they were\n gonna do with it?\n m curious if they\n wanted their own!\n 12:52 PM\n No they do not support him, of\n course it is back in the ground.\n 12:52 PM"
0,AND THATS HOW BERNIE WILL\n FIX THE US ECONorMNy
0,"Bernie or Hillary?\n Be informed. Compare them on the issues that matter.\n Suh dude\n Issue:\n ana,\n Suh dude\n Pardon?\n imgflip.com"
0,Bernie or Hillary?\n Issue\n LL\n CAPITALISM\n CAPITALISM\n ETFLIX\n ETFLIX\n N CAPITALISM\n N CAPITALISM\n CAPITALISM\n CAPITALISM\n amazon NETFLIX\n am\n am\n amazon\n URES POVERTY!\n URES POVERT\n Republican\n Republica\n Democrat\n Demo\n M Awake\n WOKE\n ASK ME HOW!\n ASK ME HOW!
0,A flash mob to vote\n or a candidate\n (especially Bernie Sanders)
0,"Use subreddit style\n m not embarrassed by someone who is socially moderate or on the religious right. It's not who\n usually vote for, but\n Subscribe +shortcut I+dashboard\n I'm not going to pretend I don't like them because they're not popular on reddit. This list is written as one long\n 31,813 readers\n pander to Bernie supporters. Who cares. They'll never li\n 5,067 users here now\n Show.\n bed\n gold hid\n hild\n RES g\n bredd\n deleted 18 ho\n UPCOMING REGISTRATION\n [removed\n DEADLINES LAST CALL MO\n 2/17, NC 2/19, AZ & UT 2/22,\n J WA\n 1 points 18 ho\n VT 2/24\n He never called Mexicans rapists so I stopped reading your low energy post right there\n RES g\n /r/The Donald\n jc5504 5 points 1\n ho\n Welcome to /r/The Donald, the largest,\n https://youtu.be/C6QE goYgQxw\n best, and closest thing to an official\n campaign subreddit for Donald Trump 2016\n bed\n RES pa\n Be advised this sub is for serious supporters. We\n censor very little compared to the bigger politics\n O WWA\n 12 ho\n 1 points\n subreddits so we also have jokes, comics, memes,\n Doesn't say it in that video either\n and other posts. We are not politically correct.\n New to the Donald? This thread is for you\n 86 TG O0 points\n 11 ho\n The Rules\n In reference to Mexicans coming over with lots of problems ""They're bringing drugs, they're bringing crime, they're\n rapist."" 0:36-0:41 mark. I get that you support Trump but c'mon man there's video evidence, energy aside\n No Spamming\n No Trolling\n bed\n dit d\n ble\n delet\n RES pa\n No Racism\n No releasing of personal information\n O WWA\n 1 point\n No vote manipulation/brigading\n He says that in reference to some of the Mexicans crossing the border. And what he said is 100% true, backed up\n No BernieBots\n No posts related to being banned from\n by data.\n other subreddits\n He did not broadly say ""Mexicans are rapists"" which is totally different.\n Sanders stuff unrelated to Trump should\n be posted at/r/BernieSanders Sucks\n He said some of the illegals crossing the border are raping people, and they indeed a\n Please be mindful of\n Reddiquette.\n get it, your agenda is to make him look like a racist, but it's not based on reality.\n Only thoughtful anti-Trump posts/comments\n\n In reference to\n Mexicans coming over with lots of problems ""They're bringing drugs, they're bringing crime, they're\n that you support Trump but c mon man there's video evidence, energy aside.\n No Spamming\n No Trolling\n bed\n dit d\n ble\n delete\n RES pa\n No Racism\n No releasing of personal information\n O WWA\n 1 point\n No vote manipulation/brigading\n He says that in reference to some of the Mexicans crossing the border. And what he said is 100% true, backed up\n No BernieBots\n No posts related to being banned from\n by data.\n other subreddits\n He did not broadly say ""Mexicans are rapists"" which is totally different.\n Sanders stuff unrelated to Trump should\n be posted at/r BernieSandersSucks\n He said some of the\n illegals crossing the border are raping people, and they indeed a\n Please be mindful of\n Reddiquette\n I get it, your agenda is to make him look like a racist, but it's not based on reality.\n Only thoughtful anti-Trump posts/comments\n allowed\n bed\n RES pa\n 4 86 TC O 0 points\n Delegates 2016\n Lol ok, you know that for a fact? You have a source with statistics? The statistics Ifound say otherwise\n As a new study from Walter Ewing, Daniel Martinez and Ruben Rumbaut points out, the foreign-born\n Candidate\n Delegates\n population rose from 7.9 percent to 13.1 percent from 1990 to 2013, and the number of unauthorized\n Donald Trump\n 81\n immigrants more than tripled, but the violent crime rate declined by 48 percent and property crime by 41\n Ted Cruz\n 17\n percent\n Marco Rubio\n 17\n John Kasich\n You won't read that article because, well, pride but there's some facts in there. And dude, I get that you\n Ben Carson\n have a Trump hard on but you should come back to reality. He made a general untrue comment about\n Mexicans who come over here. You don't have to have blanket statement that cover the entire group for\n How Can I Help?\n something to be racist. You may not consider him a racist but that comment was\n bed\n dit d\n ble\n delet\n RES pa\n REGISTER TO VOTE\n Diamond and Silke Voter Registration\n J WA\n last edited 40\n 1 point\n Page\n Trump Campaign Outreach t\n So you concede he didn't say Mexicans are rapists and that people like you are intentionally lying about\n /r The Donald\n it as part of a smear campaign.\n Trump Volunteer Media Team\n Donate & Get Updates\n Great, I think we're done here.\n bed\n RES pa\n Where do I find Trump\n 1:53 PM\n 2/24/2016\n\n VA 1 point an hour ago* last edited 46 minutes ago)\n O So you concede he didn't say Mexicans are rapists and that people like you are intentionally lying about How Can I Help?\n it as part of a smear campaign.\n REGISTER TO VOTE\n Great, I think we're done here.\n Diamond and Silke Voter Registration\n Page\n permalink source embed save save-RES parent report give gold replied\n Trump Campaign Outreach to\n /r/The Donald\n 86 TG 1 point just now\n Trump Volunteer Media Team\n Saying that the Donald was wrong is OK! I don't have a smear campaign against Don but when he\n Donate & Get Updates\n says that Mexican illegal immigrants are causing crime issues here in the states and there's facts to\n dispute it. That's not a smear campaign that's just stating facts\n Where do I find Trump\n Livestreams/videos?\n ""As for incarceration rates, immigrant men ages 18 to 39 are less than half as likely to be\n incarcerated than native-born men the same age, according to the Ewing study\n Mexican men are even less likely to be incarcerated: Their rates are one-third that of natives with\n http://www.trumpshow.info/ courtesy of\n /u/morebitcointv 5\n http://rsbon.tv/, a site for all livestreams\n similar demographic characteristics.""\n que\n ourbullshittil\n Undecided Why Should I Vote\n permalink source save save-RES parent edit disable inbox replies delete reply\n for Trump?\n This has been asked many times, try not to re-\n post this question! Responses:"
0,"literally nouns.\n Bernie Bernie Sanders\n BernieSanders\n 2016\n Greed, fraud, dishonesty, arrogance\n These are just some of the adjectives\n we use to describe Wall Street.\n 2/22/16, 10:00 AM\n 940 RETWEETS\n 2,235\n LIKES\n reubgr probs"
0,"Bernie or Hillary?\n Be informed. Compare them on the issues that matter.\n Issue:\n CHIPOTLE\n ""bowl to go, extra\n everything, some sliced\n ""Ooohh! I'll try the\n jalapenos from the back\n quesadilla!""\n Oh also! some taco shells\n on the side, please!"""
0,BERNIE SANDERS DURING THE FRENCH REVOLUTION\n N
0,"FUN FACT\n If you cut military spending by\n 100%, and taxed all $1Million+\n earnings at 100%for 10 years.you STILL\n wouldn't pay for Bernie's promises."
0,"Bernie or Hillary?\n Be informed. Compare them on the issues that matter\n Issue:\n Selena\n The loss of Selena was unsurmountable\n I loved J. Lo\n She would've been the superstar of this\n lifetime as she crossed over from the\n Spanish-language market to mainstream\n in that movie!\n English markets. Her fashion sense,\n stage presence, dance moves and\n charisma were like none I'd seen before.\n Fuck Yolanda Saldivar."
0,"YouTube\n Today\n US SENATE\n TAX CUTS & UNEMPLOYMENT BENEFITS\n C-SPAN2\n SEN. BERNIE SANDERS\n I Vermont\n ALERT\n SENATE ADJOURNED UNTIL 2pm ET MONDAY\n 23301 83429\n Senator Bernie Sanders Explains the Ending of Neon\n Genesis Evangelion (Full 8 1/2 hours)\n Dennis Molema\n Subscribe\n 115\n 66,453\n 1392 I 29\n Add to\n Share\n More"
0,"YouTube\n Today\n US SENATE\n TAX CUTS & UNEMPLOYMENT BENEFITS\n C-SPAN2\n SEN. BERNIE SANDERS\n I Vermont\n ALERT\n SENATE ADJOURNED UNTIL 2pm ET MONDAY\n 23301 83429\n Senator Bernie Sanders Explains the Ending of Neon\n Genesis Evangelion (Full 8 1/2 hours)\n Dennis Molema\n Subscribe\n 115\n 66,453\n 1392 I 29\n Add to\n Share\n More"
0,BERT ERNIE BERNIE
0,Bernie or Hilla\n Be informed. Compare them on the issues that matter\n Issue: mixing levels\n mandoghandpa
0,"Bernie or Hillary?\n Be informed. Compare them on the issues that matter.\n Issue:\n Favorite Roman\n Gaius Gracchus had the courage to\n Caesar Augustus\n fight the Senate on land reform and\n to try to lead the people to a more\n was the best and\n just position on Italian citizenship; I\n see him as proof that idealism can\n greatest.\n work, even if he wasn't completely\n succesful.\n bernieorhillary jaxbot me"
0,Bernie or Hill\n Be informed. Compare them on the issues that matter.\n Issue:\n HOVERBOARDS\n UNDER MY\n WEALREADY HAVE THEM\n ADMINISTRATION\n AND THEY ARE VERY\n DANGEROUS\n WE WILL HAVE REAL\n HOVERBOARDSBY 2020
0,Bernie or Hillar\n Be informed. Com\n n the issues that matter.\n Issue:
0,DONALDTRUMPHILLARY CLINTON TED CRUZ\n BERNIE SANDERS MARCO RUBIO\n JEBBUSH\n JOHN KASICH CHRIS CHRISTIE BEN CARSON\n innglipcom
0,"5 Things Bernie Supporters\n Will NEVER Understand:\n 1) When Bernie says ""Free"" it doesn't\n ACTUALLY mean ""Free"".\n 2) You are NOT entitled to someone\n else's hard-earned money. Ever\n 3) You CANNOT tax a nation into\n prosperity.\n 4) The ""Rich"" are not responsible for\n your financial situation, YOU are\n 5) Socialism will DESTROY the\n innovation that made America great.\n Aaron Windeknecht\n The Comical Conservative\n co mica L\n The Conservative"
0,"File: image png (253 KB, 550x368)\n C Anonymous 02/18/16 (Thu)20:56:15 No. 669687501\n [Reply]\n be me\n 20 y/o\n single, /fit, years of baseball but no friends\n >get job, in-house service technician\n >great job, double minimum wage, company vehicle, great Bernie-style benefits\n >layoffs happening\n FUCK\n reinterview with manager to re-assess my worth\n random night out at sports bar to ""celebrate"" our time\n manager asks for a ride home\n says he wants to do something for me\n sucks my cock in parking lot\n cum buckets\n drive him home\n next week 26 coworkers laid off\n not me\n manager initiates field ride out program\n >sucks my benis twice a week in my truck\n >feels good\n fast forward\n >8 years later, married, house\n >still getting blowjobs from manager who cuts my work in half twice a week to swallow my load\n spends more time sucking balls than cock always cum\n Can I recover?"
